{
  "type": "object",
  "properties": {
    "schema_version": {
      "type": "string",
      "const": "1.0.0"
    },
    "context": {
      "$ref": "#/$defs/Context"
    },
    "summary": {
      "type": "string"
    },
    "next_action": {
      "type": "string",
      "enum": [
        "analyze",
        "clarify",
        "verify",
        "generate",
        "revise",
        "review",
        "wait"
      ]
    },
    "reason": {
      "type": "string"
    },
    "required_entity_ids": {
      "type": "array",
      "items": {
        "type": "string"
      }
    },
    "issue_ids": {
      "type": "array",
      "items": {
        "type": "string"
      }
    }
  },
  "required": [
    "schema_version",
    "context",
    "summary",
    "next_action",
    "reason",
    "required_entity_ids",
    "issue_ids"
  ],
  "additionalProperties": false,
  "$schema": "https://json-schema.org/draft/2020-12/schema",
  "$id": "https://fs-workspace.example/schemas/OrchestratorPlan.schema.json",
  "title": "OrchestratorPlan",
  "description": "llm proposal only",
  "$defs": {
    "Context": {
      "type": "object",
      "properties": {
        "workspace_id": {
          "type": "string"
        },
        "session_id": {
          "type": "string"
        },
        "run_id": {
          "type": "string"
        },
        "document_id": {
          "type": "string"
        },
        "base_document_version": {
          "type": [
            "string",
            "null"
          ]
        },
        "context_snapshot_id": {
          "type": "string"
        },
        "template_id": {
          "type": "string"
        },
        "template_version": {
          "type": "string"
        }
      },
      "required": [
        "workspace_id",
        "session_id",
        "run_id",
        "document_id",
        "base_document_version",
        "context_snapshot_id",
        "template_id",
        "template_version"
      ],
      "additionalProperties": false
    }
  }
}
