{
  "schema_version": "1.0.0",
  "context": {
    "workspace_id": "ws-demo",
    "session_id": "session-demo",
    "run_id": "run-demo",
    "document_id": "fs-demo",
    "base_document_version": "dv-7",
    "context_snapshot_id": "ctx-7",
    "template_id": "traditional-abap-five",
    "template_version": "1.0.0"
  },
  "summary": "先澄清容差边界",
  "next_action": "clarify",
  "reason": "会影响核心财务控制",
  "required_entity_ids": [
    "rule-1"
  ],
  "issue_ids": [
    "issue-1"
  ]
}
